id,title,score,num_comments,author,created_utc,url,over_18,edited,spoiler,stickied
1m7m4pj,Are platforms like Databricks and Snowflake making data engineers less technical?,116,67,eczachly,2025-07-23 21:40:58,https://www.reddit.com/r/dataengineering/comments/1m7m4pj/are_platforms_like_databricks_and_snowflake/,False,False,False,False
1m7mw87,Boss is hyped about Snowflake cost optimization tools..I'm skeptical. Anyone actually seen 30%+ savings?,51,55,One-Time3079,2025-07-23 22:11:21,https://www.reddit.com/r/dataengineering/comments/1m7mw87/boss_is_hyped_about_snowflake_cost_optimization/,False,False,False,False
1m7h2dh,Fellow PMs: Did you also stop shipping useful features so we can implement  *Agents* — on infra duct-taped together and data that’s 70% vibes?,49,7,Special-Leadership75,2025-07-23 18:27:37,https://www.reddit.com/r/dataengineering/comments/1m7h2dh/fellow_pms_did_you_also_stop_shipping_useful/,False,False,False,False
1m85n59,Squashing down duplicate rows due to business rules on a code base with little data quality checks,52,8,adiyo011,2025-07-24 14:18:07,https://i.redd.it/1uk8g6p6ztef1.jpeg,False,False,False,False
1m7hlxu,How do you handle incremental + full loads in a medallion architecture (raw → bronze)? Best practices?,33,15,SurroundFun9276,2025-07-23 18:47:53,https://www.reddit.com/r/dataengineering/comments/1m7hlxu/how_do_you_handle_incremental_full_loads_in_a/,False,False,False,False
1m82tna,Anyone running lightweight ad ETL pipelines without Airbyte or Fivetran?,17,33,Jiffrado,2025-07-24 12:17:17,https://www.reddit.com/r/dataengineering/comments/1m82tna/anyone_running_lightweight_ad_etl_pipelines/,False,False,False,False
1m7vjht,Re-learning Data Engineering,16,3,frustratedhu,2025-07-24 05:05:49,https://www.reddit.com/r/dataengineering/comments/1m7vjht/relearning_data_engineering/,False,False,False,False
1m7rh7o,What level are projects no longer needed,12,10,hijkblck93,2025-07-24 01:36:53,https://www.reddit.com/r/dataengineering/comments/1m7rh7o/what_level_are_projects_no_longer_needed/,False,False,False,False
1m7j0k5,"We’ve Been Using FITT Data Architecture For Many Years, And Honestly, We Can Never Go Back",10,1,botswana99,2025-07-23 19:40:59,https://datakitchen.io/fitt-data-architecture/,False,False,False,False
1m7gzmh,Snowflake:  Way for analysts to enter object metadata without transferring  full OWNERSHIP of objects,10,4,nosebrocolli,2025-07-23 18:24:46,https://www.reddit.com/r/dataengineering/comments/1m7gzmh/snowflake_way_for_analysts_to_enter_object/,False,False,False,False
1m87zym,Built a whiteboard-style pipeline builder - it's now standard @ Instacart (Looking for contributors!),7,0,mattlianje,2025-07-24 15:48:59,https://www.reddit.com/r/dataengineering/comments/1m87zym/built_a_whiteboardstyle_pipeline_builder_its_now/,False,False,False,False
1m84o0c,ETL Unit Tests - how do you do it?,9,6,newchemeguy,2025-07-24 13:38:19,https://www.reddit.com/r/dataengineering/comments/1m84o0c/etl_unit_tests_how_do_you_do_it/,False,False,False,False
1m81i0v,Liquibase best practices,9,2,tech-man-ua,2025-07-24 11:09:28,https://www.reddit.com/r/dataengineering/comments/1m81i0v/liquibase_best_practices/,False,False,False,False
1m7gtu1,Any interest in a latency-first analytics database / query engine?,6,8,shootermans,2025-07-23 18:18:53,https://www.reddit.com/r/dataengineering/comments/1m7gtu1/any_interest_in_a_latencyfirst_analytics_database/,False,False,False,False
1m858cr,EXPLAIN ANALYZE Demystified: Reading Query Plans Like a Pro,6,0,Temporary_Depth_2491,2025-07-24 14:01:34,https://www.reddit.com/r/dataengineering/comments/1m858cr/explain_analyze_demystified_reading_query_plans/,False,False,False,False
1m84kpx,Tool for interactive pipeline diagrams,10,5,parametric-ink,2025-07-24 13:34:24,https://v.redd.it/b2sqt6o0rtef1,False,False,False,False
1m82gsw,Sample Data Warehouse for Testing,8,2,SquarePleasant9538,2025-07-24 12:00:25,https://www.reddit.com/r/dataengineering/comments/1m82gsw/sample_data_warehouse_for_testing/,False,False,False,False
1m7uhbr,Holding Microsoft Accountable,7,2,Anonymowzz12,2025-07-24 04:07:16,https://www.trevornestor.com/post/microsoft-wants-me-to-be-afraid,False,False,False,False
1m87w61,Modeling a Duplicate/Cojoined Dimension,3,3,PencilBoy99,2025-07-24 15:45:00,https://www.reddit.com/r/dataengineering/comments/1m87w61/modeling_a_duplicatecojoined_dimension/,False,False,False,False
1m7tozt,What are the biggest challenges data engineers face when building pipelines on Snowflake?,4,3,toddbeauchene,2025-07-24 03:26:19,https://www.reddit.com/r/dataengineering/comments/1m7tozt/what_are_the_biggest_challenges_data_engineers/,False,False,False,False
1m7gnrx,Python Data Compare tool,5,12,MatteShade,2025-07-23 18:12:31,https://www.reddit.com/r/dataengineering/comments/1m7gnrx/python_data_compare_tool/,False,False,False,False
1m88nej,Hyparquet: The Quest for Instant Data,3,1,dbplatypii,2025-07-24 16:13:06,https://blog.hyperparam.app/2025/07/24/quest-for-instant-data/,False,False,False,False
1m7x4xb,RBAC and Alembic,3,2,Kojimba228,2025-07-24 06:39:49,https://www.reddit.com/r/dataengineering/comments/1m7x4xb/rbac_and_alembic/,False,False,False,False
1m7ixpv,Stuck in Hell!!! Pls help,3,3,Fine-Willingness-486,2025-07-23 19:38:01,https://www.reddit.com/r/dataengineering/comments/1m7ixpv/stuck_in_hell_pls_help/,False,False,False,False
1m88pvf,Is it worth pursuing a second degree as a backup plan?,4,7,Ok_Discipline3753,2025-07-24 16:15:45,https://www.reddit.com/r/dataengineering/comments/1m88pvf/is_it_worth_pursuing_a_second_degree_as_a_backup/,False,False,False,False
1m88jyz,Connect dbt Semantic layer with Excel,3,1,Judessaa,2025-07-24 16:09:34,https://www.reddit.com/r/dataengineering/comments/1m88jyz/connect_dbt_semantic_layer_with_excel/,False,False,False,False
1m7t1nv,"ADF, dbt, snowflake - any one working on this combination",2,1,Returnforgood,2025-07-24 02:53:51,https://www.reddit.com/r/dataengineering/comments/1m7t1nv/adf_dbt_snowflake_any_one_working_on_this/,False,False,False,False
1m8bg5m,"AI-Powered Data Engineering: My Stack for Faster, Smarter Analytics",1,1,dan_the_lion,2025-07-24 17:57:54,https://estuary.dev/blog/ai-assisted-analytics-engineering/,False,False,False,False
1m7yro7,Any free game/wisdom?,1,4,Ok-Case9095,2025-07-24 08:22:16,https://www.reddit.com/r/dataengineering/comments/1m7yro7/any_free_gamewisdom/,False,False,False,False
1m8136d,"Live Report & Dashboard Generator - No Code, in less than 2 minutes",1,2,Jaded-Assignment6893,2025-07-24 10:46:58,https://www.reddit.com/r/dataengineering/comments/1m8136d/live_report_dashboard_generator_no_code_in_less/,False,False,False,False
1m7wg24,Data Simulating/Obfuscating For a Project,0,1,SubtlyOnTheNose,2025-07-24 05:58:24,https://www.reddit.com/r/dataengineering/comments/1m7wg24/data_simulatingobfuscating_for_a_project/,False,False,False,False
